"299737","0","AL JAMEAH AL SAYFIYAH TRUST","AL JAMEAH AL SAYFIYAH TRUST, 6 Mohammedi Park, Rowdell Road, Middlesex, Northolt","UB56AG","Ealing North","02088390750","farazdaqz@yahoo.com","","31/12/2019","401943.0","338468.0","Registered","Trust","Makes Grants To Individuals, Makes Grants To Organisations, Provides Human Resources, Provides Buildings/facilities/open Space, Provides Services, Provides Advocacy/advice/information, Sponsors Or Undertakes Research, Acts As An Umbrella Or Resource Body","General Charitable Purposes, Education/training, The Advancement Of Health Or Saving Of Lives, Disability, The Prevention Or Relief Of Poverty, Overseas Aid/famine Relief, Accommodation/housing, Religious Activities, Arts/culture/heritage/science, Amateur Sport, Environment/conservation/heritage, Economic/community Development/employment","Children/young People, Elderly/old People, People With Disabilities, People Of A Particular Ethnic Or Racial Origin, Other Charities Or Voluntary Bodies, The General Public/mankind","1. To propagate the ilm of Ahl-e-Bayt and their culture, philosophy, literature and heritage.2. To advance and propogate Islamic culture and education in its widest connotation, directly or indirectly, including the teaching, learning and recitation of Al-Quran.","1. TO PROPAGATE THE ILM OF AHL-E-BAYT AND THEIR CULTURE PHILOSOPHY LITERATURE AND HERITAGE. 2. TO ADVANCE AND PROPAGATE ISLAMIC CULTURE AND EDUCATION IN ITS WIDEST CONNOTATION DIRECTLY OR INDIRECTLY. INCLUDING THE TEACHING LEARNING AND RECITATION OF AL-QURAN. 3. TO ADVANCE AND PROPAGATE EDUCATION AND LEARNING INCLUDING THE ESTABLISHMENT AND MAINTENANCE AND SUPPORT OF AL JAMEAH AL SAYFIYAH SURAT AND KARACHI AND EDUCATIONAL INSTITUTIONS PROFESSORSHIPS LECTURESHIPS AND PRIZES AND INCLUDING THE ADVANCEMENT OR PROMOTION OF LITERATURE IN ALL OR ANY LANGUAGE AND ESPECIALLY ARABIC LITERATURE. FOR FURTHER DETAILS SEE CLAUSE 3 OF TRUST DEED."
"1189965","0","VIRUTCHAM TRUST","10 BURR CLOSE, KEMPSTON, BEDFORD","MK42 7FF","Bedford","+447956340509","virutchamtrustuk@gmail.com","www.virutcham.org.uk","",,,"Registered","Other","Makes Grants To Individuals, Makes Grants To Organisations, Provides Services, Provides Advocacy/advice/information, Sponsors Or Undertakes Research","General Charitable Purposes, Education/training, The Advancement Of Health Or Saving Of Lives, Disability, The Prevention Or Relief Of Poverty, Overseas Aid/famine Relief, Economic/community Development/employment","Children/young People, Elderly/old People, People With Disabilities, Other Charities Or Voluntary Bodies, The General Public/mankind","The following objects are for the public benefit of those who are socially or economically disadvantaged in deprived areas.
1.	The advancement of Education;
2.	The prevention or relief of poverty;
3.	The relief of sickness and the preservation and protection of good health.
The Charity would look to expand the scope of their Public Benefit activities to Public in general.","THE FOLLOWING OBJECTS ARE FOR THE PUBLIC BENEFIT OF THOSE WHO ARE SOCIALLY OR ECONOMICALLY DISADVANTAGED IN DEPRIVED AREAS OF NORTH AND EAST SRI LANKA:-
1.THE ADVANCEMENT OF EDUCATION;
2.THE PREVENTION OR RELIEF OF POVERTY;
3.THE RELIEF OF SICKNESS AND THE PRESERVATION AND PROTECTION OF GOOD HEALTH.
THE CHARITY WOULD LOOK TO EXPAND THE SCOPE OF THEIR PUBLIC BENEFIT ACTIVITIES TO PUBLIC IN GENERAL, WHEREVER THE CHARITY IS ABLE TO MAKE DECISIONS BASED ON RELIABLE INFORMATION AND ESTABLISH THE RESOURCES TO IMPLEMENT AND MONITOR ASSISTANCE THAT CREATES A SIGNIFICANT IMPACT.
[NOTHING IN THIS CONSTITUTION SHALL AUTHORISE AN APPLICATION OF THE PROPERTY OF THE CHARITY FOR PURPOSES WHICH ARE NOT CHARITABLE IN ACCORDANCE WITH SECTION 7 OF THE CHARITIES AND TRUSTEE INVESTMENT (SCOTLAND) ACT 2005 AND/OR SECTION 2 OF THE CHARITIES ACT (NORTHERN IRELAND) 2008.]"
"1109368","0","CENTRE FOR COMMUNITY DEVELOPMENT","THULASI, BRIDGE END CLOSE, KINGSTON UPON THAMES, SURREY","KT2 6PZ","Richmond Park","02085461560","admin.ccd@sangu.org","","31/03/2020","36230.0","43020.0","Registered","Other","Makes Grants To Organisations, Provides Human Resources, Provides Services, Provides Advocacy/advice/information, Sponsors Or Undertakes Research","General Charitable Purposes, Education/training, The Advancement Of Health Or Saving Of Lives, Disability, The Prevention Or Relief Of Poverty, Overseas Aid/famine Relief, Arts/culture/heritage/science, Amateur Sport, Environment/conservation/heritage, Economic/community Development/employment","Children/young People, Elderly/old People, People With Disabilities, Other Charities Or Voluntary Bodies, Other Defined Groups, The General Public/mankind","Advancement of education, relief of sickness suffering and distress, relief of poverty, preservation and protection of good health, promotion of peace and conflict resolution through non-violence means, provision of recreation or leisure with the objective of improving the conditions of life, and promotion of equality of opportunity and good race relations.","TO PROMOTE ANY CHARITABLE PURPOSE FOR THE BENEFIT OF THE COMMUNITIES, INCLUDING OF SRI LANKAN ORIGIN, AND IN PARTICULAR BUT NOT EXCLUSIVELY:

A. ADVANCEMENT OF EDUCATION
B. RELIEF OF SICKNESS, SUFFERING AND DISTRESS
C. RELIEF OF POVERTY
D. TO PRESERVE AND PROTECT GOOD HEALTH
E. PROMOTION OF PEACE AND CONFLICT RESOLUTION THROUGH NON-VIOLENCE MEANS
F. TO PROVIDE OR ASSIST IN THE PROVISION OF FACILITIES FOR RECREATION OR OTHER LEISURE TIME OCCUPATION IN THE INTERESTS OF SOCIAL WELFARE WITH THE OBJECT OF IMPROVING THE CONDITIONS OF LIFE OF THE BENEFICIARIES
G. PROMOTION OF EQUALITY OF OPPORTUNITY AND GOOD RACE RELATIONS BETWEEN PERSONS OF DIFFERENT RACIAL GROUPS"
"1157682","0","CUDOG HEART FOUNDATION","12, UPPER BERKELEY STREET, LONDON","W1H 7QD","Cities of London and Westminster","07415132274","info@cudogheart.com","www.cudogheartfoundation.com","29/02/2020","1773.0","1358.0","Registered","Charitable company","Makes Grants To Individuals, Makes Grants To Organisations, Provides Other Finance, Provides Human Resources, Provides Buildings/facilities/open Space, Provides Services, Sponsors Or Undertakes Research, Acts As An Umbrella Or Resource Body","General Charitable Purposes, Education/training, The Advancement Of Health Or Saving Of Lives, Disability, The Prevention Or Relief Of Poverty, Overseas Aid/famine Relief, Accommodation/housing, Religious Activities, Arts/culture/heritage/science, Environment/conservation/heritage, Economic/community Development/employment, Recreation","Children/young People, Elderly/old People, People With Disabilities, The General Public/mankind","We use raised funds and received donations to send by box Children's books and toys (also donated) to schools in remote areas of the Philippines to advance children's education. We help pay medical bills, send students to school and university, we help to equip schools and churches with various needed items in the Philippines. We serve hot tea, coffee and sandwiches to the homeless in London.","THE FOLLOWING OBJECTS ARE ESTABLISHED FOR THE PUBLIC BENEFIT WORLDWIDE ACCORDING TO THE LAW OF ENGLAND AND WALES:-
1)TO ADVANCE THE CHRISTIAN FAITH IN ACCORDANCE WITH THE STATEMENT OF FAITH ATTACHED HERETO;
2)TO ADVANCE EDUCATION;
3)TO ADVANCE IN LIFE AND RELIEVE NEEDS OF YOUNG PEOPLE THROUGH:
(A)THE PROVISION OF RECREATIONAL AND LEISURE TIME ACTIVITIES PROVIDED IN THE INTEREST OF SOCIAL WELFARE, DESIGNED TO IMPROVE THEIR CONDITIONS OF LIFE;
(B)PROVIDING SUPPORT AND ACTIVITIES WHICH DEVELOP THEIR SKILLS, CAPACITIES AND CAPABILITIES TO ENABLE THEM TO PARTICIPATE IN SOCIETY AS MATURE AND RESPONSIBLE INDIVIDUALS.
4)TO RELIEVE POVERTY; 
5)TO RELIEVE SICKNESS AND TO PRESERVE AND PROTECT GOOD HEALTH; AND
6)TO SUPPORT SUCH OTHER GENERAL CHARITABLE PURPOSES AS THE TRUSTEES MAY IN THEIR ABSOLUTE DISCRETION DEEM FIT"
"1111322","0","ASIAN SOCIAL & HUMANITARIAN ASSOCIATION","49 STATION ROAD, LONDON","E12 5BP","East Ham","07535385103","asha-youthproject@hotmail.com","","31/03/2020","58337.0","57273.0","Registered","Other","Makes Grants To Individuals, Provides Human Resources, Provides Services, Provides Advocacy/advice/information, Other Charitable Activities","General Charitable Purposes, Education/training, The Prevention Or Relief Of Poverty, Overseas Aid/famine Relief, Religious Activities, Arts/culture/heritage/science, Economic/community Development/employment, Other Charitable Purposes","Children/young People, Elderly/old People, People With Disabilities, People Of A Particular Ethnic Or Racial Origin, Other Charities Or Voluntary Bodies, The General Public/mankind","ASHA is running the following activities: Advice information services for young people aged 13-19 old on Job Search, CV writing, interview skills and training and education opportunities.Youth achievement project, summer holiday Play scheme, young offenders project, women development project, home work tuition project, community cohesion  and preventing  extremism & violence project.","1. TO ADVANCE OF EDUCATION AMONG MEMBERS OF BLACK AND ETHNIC MINORITIES COMMUNITIES WITHIN THE UK, IN PARTICULAR WITHIN THE LONDON AREA, BY THE PROVISION OF SUPPLEMENTARY MOTHER TONGUE CLASSES FOR STUDENTS UNDERACHIEVING IN MAINSTREAM EDUCATION.
2.  THE PROVISION, IN THE INTERESTS OF SOCIAL WELFARE, OF FACILITIES FOR RECREATION OR OTHER LEISURE TIME OCCUPATION AMONG MEMBERS OF BME COMMUNITIES WITHIN THE UK AND IN PARTICULAR THE LONDON AREA, WITH THE OBJECT OF IMPROVING THEIR CONDITIONS OF LIFE.
3. THE RELIEF OF POVERTY HARDSHIP AND DISTRESS AND THE PRESERVATION AND PROTECTION OF GOOD HEALTH, BOTH WITHIN THE UK AND OVERSEAS, BY SUCH EXCLUSIVELY CHARITABLE MEANS AS THE TRUSTEES SHALL FROM TIME TO TIME
DETERMINE."
"274954","0","THE JAMUNA TRUST","HUNTERS HOUSE, 24 High Street, Bridge, CANTERBURY","CT4 5JY","Canterbury","01227 832697","JAMUNATRUST274954@GMAIL.COM","","05/04/2020","2064.0","3816.0","Registered","Other","Makes Grants To Individuals, Makes Grants To Organisations","General Charitable Purposes, Education/training, The Advancement Of Health Or Saving Of Lives, Disability, The Prevention Or Relief Of Poverty, Overseas Aid/famine Relief, Accommodation/housing, Arts/culture/heritage/science, Environment/conservation/heritage, Economic/community Development/employment","Children/young People, Elderly/old People, People With Disabilities, Other Charities Or Voluntary Bodies, Other Defined Groups","Support for education, medical work, poor people and people with disabilities","THE ADMINISTRATION OF ANY PROPERTY OR ESTATE OCCUPIED OR USED OR INTENDED FOR ANY CHARITABLE OBJECT OR PURPOSE INSTITUTION OR WORK, THE SUPPORT BY CONTRIBUTION, LOAN, GIFT, SUBSCRIPTION OR OTHERWISE OF ANY CHARITABLE INSTITUTION OR WORK WHICH SHALL BE ESTABLISHED OR MAINTAINED, FOR ANY OF THE FOLLOWING PURPOSES; TO PROVIDE SUCCOUR, RELIEF AND REHABILITATION TO THOSE WHO BY REASON OF AGE, POVERTY, MALNUTRITION, DISEASE OR NATURAL DISASTER HAVE BEEN DEPRIVED OF THE BASIC NECESSITIES OF HUMAN LIFE, TO PROMOTE AND SUPPORT RELIGIOUS AND SECULAR EDUCATION."
"1137323","0","EDEN NETWORK GREATER LONDON","THE MESSAGE TRUST, LANCASTER HOUSE, HARPER ROAD, SHARSTON INDUSTRIAL AREA, MANCHESTER","M22 4RG","Wythenshawe and Sale East","01619462300","london@eden-network.org","www.joineden.org","29/02/2020","2365.0","1523.0","Registered","Charitable company","Makes Grants To Organisations, Provides Human Resources, Provides Buildings/facilities/open Space, Provides Services, Provides Advocacy/advice/information, Acts As An Umbrella Or Resource Body","General Charitable Purposes, Education/training, The Advancement Of Health Or Saving Of Lives, Disability, The Prevention Or Relief Of Poverty, Accommodation/housing, Religious Activities, Arts/culture/heritage/science, Economic/community Development/employment","Children/young People, People With Disabilities, People Of A Particular Ethnic Or Racial Origin, Other Charities Or Voluntary Bodies, The General Public/mankind","YOUTH AND COMMUNITY WORK IN COMMUNITIES SUFFERING THE EFFECTS OF ECONOMIC AND SOCIAL DEPRIVATION - THROUGHOUT GREATER LONDON","THE CHARITYãS OBJECTS (¶OBJECTS÷) ARE SPECIFICALLY RESTRICTED TO THE FOLLOWING:

1. TO ADVANCE EDUCATION AND TRAINING WITHIN SOCIALLY AND ECONOMICALLY DISADVANTAGED COMMUNITIES OF GREATER LONDON (THE AREA OF BENEFIT).
2. HELP YOUNG PEOPLE WITHIN THE AREA OF BENEFIT, ESPECIALLY BUT NOT EXCLUSIVELY THROUGH LEISURE TIME ACTIVITIES, SO AS TO DEVELOP THEIR CAPABILITIES THAT THEY MAY GROW TO FULL MATURITY AS INDIVIDUALS AND MEMBERS OF SOCIETY.  
3. TO ADVANCE, COMMUNICATE, EXPLAIN AND DEMONSTRATE THE CHRISTIAN FAITH WITHIN THE AREA OF BENEFIT IN ACCORDANCE WITH THE BASIS OF FAITH. 
4. TO RELIEVE POVERTY AND SICKNESS AND PROMOTE AND PROTECT GOOD HEALTH OF PEOPLE LIVING IN THE AREA OF BENEFIT.
5. TO DEVELOP THE CAPACITY AND SKILLS OF THE RESIDENTS OF THE AREA OF BENEFIT IN SUCH A WAY THAT THEY ARE BETTER ABLE TO IDENTIFY, AND HELP MEET, THEIR NEEDS AND TO PARTICIPATE MORE FULLY IN SOCIETY.
6. TO PROMOTE SOCIAL INCLUSION FOR THE PUBLIC BENEFIT IN THE AREA OF BENEFIT BY PREVENTING PEOPLE FROM BECOMING SOCIALLY EXCLUDED, RELIEVING THE NEEDS OF THOSE PEOPLE WHO ARE SOCIALLY EXCLUDED AND ASSISTING THEM TO INTEGRATE INTO SOCIETY*.	
*FOR THE PURPOSE OF THIS CLAUSE 'SOCIALLY EXCLUDED' MEANS BEING EXCLUDED FROM SOCIETY, OR PARTS OF SOCIETY, AS A RESULT OF ONE OF MORE OF THE FOLLOWING FACTORS: UNEMPLOYMENT; FINANCIAL HARDSHIP; YOUTH OR OLD AGE; ILL HEALTH (PHYSICAL OR MENTAL); SUBSTANCE ABUSE OR DEPENDENCY INCLUDING ALCOHOL AND DRUGS; DISCRIMINATION ON THE GROUNDS OF SEX, RACE, DISABILITY, ETHNIC ORIGIN, RELIGION, BELIEF, CREED, SEXUAL ORIENTATION OR GENDER RE-ASSIGNMENT; POOR EDUCATIONAL OR SKILLS ATTAINMENT; RELATIONSHIP AND FAMILY BREAKDOWN; POOR HOUSING (THAT IS HOUSING THAT DOES NOT MEET BASIC HABITABLE STANDARDS; CRIME (EITHER AS A VICTIM OF CRIME OR AS AN OFFENDER REHABILITATING INTO SOCIETY).
7. TO PROMOTE SUCH OTHER CHARITABLE PURPOSES FOR THE BENEFIT OF THE RESIDENTS OF THE AREA OF BENEFIT IN SUCH A WAY AS THE TRUSTEES SHALL THINK FIT."
"1159406","0","GO! (GREAT OPPORTUNITIES) TOGETHER","GO (Great Opportunities) Together, 4th Floor, 18 St Cross Street,, London","EC1N 8UN","Holborn and St Pancras","01189076397","contact@greatopportunities.org.uk","http://www.greatopportunities.org.uk/","30/09/2020","1890.0","2020.0","Registered","CIO","Provides Human Resources, Provides Services, Provides Advocacy/advice/information, Sponsors Or Undertakes Research, Other Charitable Activities","General Charitable Purposes, Education/training, The Advancement Of Health Or Saving Of Lives, Disability, The Prevention Or Relief Of Poverty, Religious Activities, Arts/culture/heritage/science, Amateur Sport, Environment/conservation/heritage, Economic/community Development/employment, Human Rights/religious Or Racial Harmony/equality Or Diversity, Recreation, Other Charitable Purposes","Children/young People, People With Disabilities, Other Charities Or Voluntary Bodies, Other Defined Groups, The General Public/mankind","Go! Provides activities  for young people and short break activities for children. We work with all young people and particularly those with additional needs. We encourage participation by volunteers of all ages and as part of our fundraising and mentoring activities. We offer experiences in art, music, theatre, travel, and a range of work experience. Our work is primarily in the south of England","1. TO ADVANCE IN LIFE AND HELP YOUNG PEOPLE THROUGH:
(A) THE PROVISION OF RECREATIONAL AND LEISURE TIME ACTIVITIES PROVIDED IN THE INTEREST OF SOCIAL WELFARE, DESIGNED TO IMPROVE THEIR CONDITIONS OF LIFE;
(B) PROVIDING SUPPORT AND ACTIVITIES WHICH DEVELOP THEIR SKILLS, CAPACITIES AND CAPABILITIES TO ENABLE THEM TO PARTICIPATE IN SOCIETY AS MATURE AND RESPONSIBLE INDIVIDUALS.
2. TO HELP YOUNG PEOPLE, ESPECIALLY BUT NOT EXCLUSIVELY THROUGH LEISURE TIME ACTIVITIES, SO AS TO DEVELOP THEIR CAPABILITIES THAT THEY MAY GROW TO FULL MATURITY AS INDIVIDUALS AND MEMBERS OF SOCIETY.
3. TO ACT AS A RESOURCE FOR YOUNG PEOPLE UP TO THE AGE OF 25 LIVING IN ENGLAND OR WALES [BUT MOST PARTICULARLY IN THE SOUTH OF ENGLAND] BY PROVIDING ADVICE AND ASSISTANCE AND ORGANISING PROGRAMMES OF PHYSICAL, EDUCATIONAL AND OTHER ACTIVITIES AS A MEANS OF:
(A) ADVANCING IN LIFE AND HELPING YOUNG PEOPLE BY DEVELOPING THEIR SKILLS, CAPACITIES AND CAPABILITIES TO ENABLE THEM TO PARTICIPATE IN SOCIETY AS INDEPENDENT, MATURE AND RESPONSIBLE INDIVIDUALS;
(B) ADVANCING EDUCATION;
(C) RELIEVING UNEMPLOYMENT;
(D) PROVIDING RECREATIONAL AND LEISURE TIME ACTIVITY IN THE INTERESTS OF SOCIAL WELFARE FOR PEOPLE LIVING IN THE AREA OF BENEFIT WHO HAVE NEED BY REASON OF THEIR YOUTH, AGE, INFIRMITY OR DISABILITY, POVERTY OR SOCIAL AND ECONOMIC CIRCUMSTANCES WITH A VIEW TO IMPROVING THE CONDITIONS OF LIFE OF SUCH PERSONS.
(E) ADVICE AND GUIDANCE RELATING TO INFORMATION FOR YOUNG PEOPLE OR THEIR FAMILIES IN MATTERS RELATING TO THE RELIEF OF FINANCIAL HARDSHIP BY THE PROVISION OF FREE LEGAL ADVICE AND ASSISTANCE TO PERSONS WHO, THROUGH LACK OF MEANS, WOULD OTHERWISE BE UNABLE TO OBTAIN SUCH ADVICE."
"1131948","0","ACHEINU LIMITED","240 HENDON WAY, LONDON","NW4 3NL","Hendon","02080905094","info@theboysclubhouse.co.uk","www.theboysclubhouse.co.uk","30/04/2020","529700.0","385760.0","Registered","Charitable company","Makes Grants To Individuals, Provides Buildings/facilities/open Space, Provides Services","Education/training, Disability, The Prevention Or Relief Of Poverty, Religious Activities, Amateur Sport, Economic/community Development/employment","Children/young People, People With Disabilities, People Of A Particular Ethnic Or Racial Origin","- EDUCATION/TRAINING
- RELIGIOUS ACTIVITIES
- SPORT/RECREATION
- ECONOMIC/COMMUNITY DEVELOPMENT
- THE PROVISION OR RELIEF OF POVERTY","(I) THE RELIEF OF POVERTY HARDSHIP AND DISTRESS INCLUDING EMOTIONAL DISTRESS AMONGST JEWISH
CHILDREN AND YOUNG PEOPLE IN PARTICULAR BUT NOT EXCLUSIVELY BY THE PROVISION OF EDUCATIONAL
SERVICES, VOCATIONAL TRAINING AND RECREATIONAL FACILITIES WITH THE OBJECT OF IMPROVING THE
CONDITIONS OF LIFE OF SUCH PERSONS AND SO THAT THEY BECOME ACTIVELY ENGAGED IN SOCIETY AND
USEFUL CITIZENS
(II) THE ADVANCEMENT OF EDUCATION OF JEWISH YOUNG PERSONS WHOSE WELFARE IS AT RISK OR IMPAIRED BY ABUSE OR NEGLECT OR SOCIAL DISADVANTAGE
(III) THE ADVANCEMENT OF SUCH OTHER OBJECTS AS ARE FOR THE BENEFIT OF THE PUBLIC AND ARE
CHARITABLE ACCORDING TO ENGLISH LAW"
"1118180","0","KIDCARE INTERNATIONAL","Kidcare International, S B C House, Restmor Way, Wallington","SM6 7AH","Carshalton and Wallington","07724711700","info@kidcareinternational.co.uk","www.kidcare-international.org","31/03/2020","103293.0","125535.0","Registered","Charitable company","Makes Grants To Individuals, Makes Grants To Organisations, Provides Human Resources, Provides Buildings/facilities/open Space, Provides Services, Provides Advocacy/advice/information, Acts As An Umbrella Or Resource Body","General Charitable Purposes, Education/training, The Advancement Of Health Or Saving Of Lives, Disability, The Prevention Or Relief Of Poverty, Overseas Aid/famine Relief, Accommodation/housing, Religious Activities, Economic/community Development/employment","Children/young People, Elderly/old People, People With Disabilities, Other Charities Or Voluntary Bodies, Other Defined Groups, The General Public/mankind","KIDCARE INTERNATIONAL  is a Christian charity founded in April 1999. We are UK based private company and charitable trust with partners and subsidiary branches in different nations. We are dedicated to addressing the needs of children, youth development, strengthening families and contributing positively to as many communities as we can both in the UK and around the world.","1) TO RELIEVE CHILDREN AND YOUNG ADULTS LIVING IN (BUT NOT BE WAY OF LIMITATION) ASIA, AFRICA, EUROPE AND SOUTH AMERICA AND WHO ARE IN CONDITIONS OF NEED OR FINANCIAL HARDSHIP EITHER GENERALLY OR INDIVIDUALLY, IN ACCORDANCE WITH CHRISTIAN PRINCIPLES BY MAKING GRANTS OF MONEY FOR PROVIDING OR PAYING FOR ITEMS, SERVICES OR FACILITIES SUCH AS THE ESTABLISHMENT OF MEDICAL UNITS, FEEDING PROGRAMMES, CHRISTIAN ORPHANAGES, SCHOOLS, CHILDREN AND YOUTH SUPPORT CENTRES AND INCOME GENERATION PROJECTS.
2) TO PROVIDE, FOR THE BENEFIT OF THE PUBLIC, SUPPORT BY WAY OF MARRIAGE SEMINARS, PARENTING CLASSES AND OTHER MATERIAL PROVISION FOR FAMILIES AND ASSISTANCE THROUGH CONCILIATION FOR COUPLES WHOSE RELATIONSHIPS APPEAR TO BE BREAKING DOWN.
3) TO ADVANCE THE CARE AND DEVELOPMENT OF CHILDREN AND STRONG FAMILY UNITS IN ACCORDANCE WITH CHRISTIAN PRINCIPLES."
"1081266","0","SALVATION REACHOUT MINISTRIES","147 CATOR STREET, LONDON","SE15 6AA","Camberwell and Peckham","07426737372","salreachoutmin@yahoo.co.uk","salvationreachoutministries.org.uk","30/04/2019","2500.0","2640.0","Registered","Other","Makes Grants To Individuals, Makes Grants To Organisations, Provides Human Resources, Provides Buildings/facilities/open Space, Provides Services, Provides Advocacy/advice/information, Sponsors Or Undertakes Research","Education/training, The Advancement Of Health Or Saving Of Lives, Disability, The Prevention Or Relief Of Poverty, Overseas Aid/famine Relief, Accommodation/housing, Religious Activities, Environment/conservation/heritage, Economic/community Development/employment","Children/young People, Elderly/old People, People With Disabilities, People Of A Particular Ethnic Or Racial Origin, Other Defined Groups, The General Public/mankind","IN UK TO DIVERT CRIMES, PREVENT RE-OFFENDING AND HOMELESSNESS; STRENTHEN AND SUSTAIN COMMUNITIES BY PROVIDING REHABILITATION, EMPLOYABLE SKILLS TRAINING AND SUPPORT TO PEOPLE WITH SPECIFIC NEEDS. RELIEVE POVERTY,SICKNESS AND DISTRESS. ADVANCE SUSTAINABLE DEVELOPMENT AND COMMUNITY CAPACITY BUILDING. SUPPORT AND ASSIST MIGRANTS AND REFUGEES.  PREACH AND TEACH THE WORD OF GOD ACCORDING TO THE BIBLE.","(1) TO FURTHER THE CHRISTIAN RELIGION  (2) TO PROVIDE HELP FOR THE POOR AND NEEDY"
"1170126","0","ITESO WELFARE ASSOCIATION ( IWA )","Capital Office Ltd, Kemp House, 152-160 City Road, LONDON","EC1V 2NX","Islington South and Finsbury","07375126811","","www.iwa-uk.org.uk","31/03/2021","11091.0","8381.0","Registered","CIO","Makes Grants To Individuals, Makes Grants To Organisations, Provides Buildings/facilities/open Space, Provides Services, Provides Advocacy/advice/information, Acts As An Umbrella Or Resource Body","General Charitable Purposes, Education/training, The Advancement Of Health Or Saving Of Lives, Disability, The Prevention Or Relief Of Poverty, Amateur Sport, Environment/conservation/heritage, Economic/community Development/employment, Recreation, Other Charitable Purposes","Children/young People, Elderly/old People, People With Disabilities, People Of A Particular Ethnic Or Racial Origin, Other Charities Or Voluntary Bodies, The General Public/mankind","IWA aspires to improve access to healthcare and education. We aim to achieve this through stakeholder engagement, resource mobilisation, interpretation services, knowledge management, assisted living, outreach programmes, research, sponsorship and grant making.","IWA (UK) FURTHERS THE FOLLOWING CHARITABLE PURPOSES FOR THE PUBLIC BENEFIT IN THE UNITED KINGDOM AND AFRICA:
1) THE PROMOTION OF GOOD HEALTH AND WELLBEING IN PARTICULAR BY RELIEVING SICKNESS AND DISEASE
2) THE ADVANCEMENT OF EDUCATION AND TRAINING
3) THE PREVENTION OR RELIEF OF POVERTY INCLUDING THE PROMOTION OF SOCIAL INCLUSION OF THOSE ITESO PEOPLE AND OTHER VULNERABLE SOCIAL GROUPS WHO ARE EXCLUDED FROM SOCIETY DUE TO THEIR ECONOMIC AND/OR SOCIAL CIRCUMSTANCES
4) THE PRESERVATION AND PROTECTION OF THE NATURAL ENVIRONMENT BY PROMOTING A MORE HEALTHY AND SUSTAINABLE ENVIRONMENT
5) THE PROMOTION OF THE ARTS, CULTURE AND HERITAGE IN PARTICULAR THE CULTURE, HISTORY, LANGUAGE AND HERITAGE OF THE ITESO PEOPLE IN THE UNITED KINGDOM"
"289648","0","ASIAN FOUNDATION FOR HELP","45 PARK ROYAL ROAD, LONDON","NW10 7LQ","Ealing Central and Acton","02088384900","info@asianfoundation.org.uk","www.asianfoundation.org.uk","31/12/2019","91932.0","117492.0","Registered","Other","Makes Grants To Individuals, Makes Grants To Organisations, Provides Human Resources, Other Charitable Activities","General Charitable Purposes, Education/training, The Advancement Of Health Or Saving Of Lives, Disability, The Prevention Or Relief Of Poverty, Overseas Aid/famine Relief, Accommodation/housing, Religious Activities, Arts/culture/heritage/science, Animals, Environment/conservation/heritage, Economic/community Development/employment, Other Charitable Purposes","Children/young People, Elderly/old People, People With Disabilities, Other Charities Or Voluntary Bodies, The General Public/mankind","The charity, raises funds to be used for various good causes, including for the blind, elderly, sick and underprivileged people.It has helped various medical centres and educational bodies and run a Food for Life Programme as well as a cow protection scheme. Overall, apart from the above, over 85 Eye camps were carried out during the year and 4 Ambulances were donated during the year.","TO PROMOTE ANY CHARITABLE PURPOSE WITHOUT DEROGATION FROM GENERALITY OF THE FOREGOING TO THE CARE SERVICE AND MAINTENANCE OF THE SICK NEEDY AGED INFIRM MENTALLY AND FOR PHYSICALLY HANDICAPPED."
